{
  "schema": "mosaico-ideas/project-upload/v1",
  "project": {
    "title": "",
    "categories": [],
    "boards": [],
    "tags": [],
    "license": "",
    "external_links": []
  },
  "content": {
    "readme": "README.md",
    "covers": [],
    "resources": [],
    "attachments": []
  },
  "release": {
    "changelog": ""
  }
}
